{
  "schema_version": "1",
  "member": {"name": "ООО «Пример-Строй» (вымышленная компания)", "inn": null, "role": "contractor", "is_state_entity": false, "sro_kinds": ["build"], "membership_date": "2024-05-20"},
  "contract": {
    "number": "ГП-14/2026", "date": "2026-04-03",
    "subject_text": "Подрядчик обязуется выполнить комплекс работ по строительству многоквартирного жилого дома со встроенными помещениями по адресу: г. Пример, ул. Строителей, уч. 7, включая устройство монолитного каркаса, кладку стен, кровлю, внутренние инженерные системы, отделку и благоустройство, а также поставку и монтаж лифтового оборудования, и сдать результат Заказчику.",
    "kind": "construction", "kind_basis": "п. 1.1: выполнить комплекс работ по строительству и сдать результат; п. 6 — приёмка по актам КС-2/КС-3",
    "mixed_parts": [], "price_rub": 148000000.0, "price_basis": "п. 3.1: 148 000 000 руб., в т. ч. НДС 22 %, с учётом ДС № 1", "price_includes_vat": true,
    "addenda": [{"number": "1", "date": "2026-06-30", "price_rub": 148000000.0, "note": "цена увеличена со 140 000 000"}],
    "status": "active", "status_basis": null, "period_from": "2026-04-10", "period_to": "2027-09-30",
    "procurement": "direct", "procurement_basis": "договор заключён по результатам переговоров, торги не проводились (письмо заказчика)",
    "executed_rub": 39400000.0, "executed_basis": "КС-3 № 1–3 за апрель–июнь 2026", "has_final_act": false, "termination_document": null
  },
  "customer": {"name": "ООО «СЗ Пример-Девелопмент»", "inn": null, "kind": "developer", "kind_basis": "разрешение на строительство № 00-000-2026 от 12.02.2026 выдано заказчику; проектная декларация на наш.дом.рф"},
  "object": {"name": "Многоквартирный жилой дом со встроенными помещениями, 14 этажей", "address": "г. Пример, ул. Строителей, уч. 7", "cadastral": null,
             "is_capital": true, "permit_required": true, "housing_type": "none", "category": "ordinary", "basis": "проектная документация: жилой дом высотой 44 м, к объектам ст. 48.1 ГрК РФ не относится"},
  "work_type": "construction",
  "works": [
    {"name": "Устройство монолитного железобетонного каркаса (фундаментная плита, стены, перекрытия)", "amount_rub": 62000000.0, "source": "приложение № 1, разд. 1"},
    {"name": "Кладка наружных и внутренних стен из газобетонных блоков", "amount_rub": 14000000.0, "source": "приложение № 1, разд. 2"},
    {"name": "Устройство кровли из рулонных материалов", "amount_rub": 6000000.0, "source": "приложение № 1, разд. 3"},
    {"name": "Устройство внутренних систем водоснабжения, канализации и отопления", "amount_rub": 12000000.0, "source": "приложение № 1, разд. 4"},
    {"name": "Устройство внутренних сетей электроснабжения", "amount_rub": 9000000.0, "source": "приложение № 1, разд. 5"},
    {"name": "Отделочные работы: штукатурка, шпатлёвка, окраска, плитка, полы", "amount_rub": 22000000.0, "source": "приложение № 1, разд. 6"},
    {"name": "Поставка лифтового оборудования", "amount_rub": 11000000.0, "source": "приложение № 1, разд. 7"},
    {"name": "Монтаж лифтов и пусконаладочные работы лифтов", "amount_rub": 4000000.0, "source": "приложение № 1, разд. 7"},
    {"name": "Устройство наружных сетей водопровода и канализации", "amount_rub": 5000000.0, "source": "приложение № 1, разд. 8"},
    {"name": "Благоустройство территории: озеленение, детская площадка, малые архитектурные формы", "amount_rub": 3000000.0, "source": "приложение № 1, разд. 9"}
  ],
  "sources": [{"file": "dogovor-gp-14-2026.pdf", "kind": "contract", "pages": 26, "extraction_confidence": 0.95}, {"file": "prilozhenie-1-vor.xlsx", "kind": "estimate", "pages": null, "extraction_confidence": 1.0}],
  "as_of": "2026-09-01",
  "notes": "Учебный пример: все названия и суммы вымышлены."
}
